the most frequently found bacteria in dental plaque samples respectively	less than optimal in many patients with type 2 diabetes mellitus
the risk of developing [UNK] [UNK] [UNK]	the process to find novel ways of controlling it
in the [UNK]	in a chest x ray
the ability to reduce [UNK] risk	in developing a treatment strategy for advanced prostate cancer
for the future of patients with	from correction of a vitamin D deficit
a role in the development of lung cancer	an association between psoriasis and cardiovascular diseases such as valvular disease
a significant risk of the onset of gastric cancer	that the risk may be increased with a high intake of salt per se
important	indeed beneficial to individuals
with [UNK]	with management
its own	48.2 %
the [UNK]	new methods to characterize immune responses toward these proteins
on the need	on biomarker discovery Over a last decade
with [UNK]	with activation of the pro-inflammatory mechanism promoting atherogenesis
in the us	in women yet
in the [UNK]	In this Review
[UNK]	greater than 20 %
the clinical trials	available epidemiological evidence
[UNK]	over time
the same [UNK]	other factors
the same disease	the rate of disease progression
a pivotal role in the onset of cardiovascular disease including hypertension	a pivotal role in the development of cardiovascular disease , including myocardial fibrosis
the most important role of [UNK] in the development of cancer	morbidity in patients with diabetes mellitus
[UNK] [UNK] [UNK] [UNK]	important in identifying patients at high risk of developing psychosocial disorders and referring them on to health specialists
to the major health problem	to cardiovascular disease pathophysiology
to treat the disease	as prognosticators of disease process while the biomarkers that envisage cardiovascular risk have an important biological basis
a family	none of the recognised risk factors indicating the gaps in our knowledge of the epidemiology of this disease
the [UNK] [UNK]	diabetes
a major health problem	microvascular complications that increase morbidity in patients with diabetes mellitus
[UNK]	ideas
tumor microenvironment tme and molecular pathology in [UNK]	tumor microenvironment ( TME ) and molecular pathology
to the disease	to be validated still
the risk of gastric cancer	etiopathogenesis
the most important role of lung cancer	in frequency as the incidence of the condition increases
the same disease	the risk of cancer in patients with mutations in high - penetrance genes
the most important role of [UNK] in the development of lung cancer	underway
a significant effect	greater risk reduction from moderate daily alcohol intake At the same time
significantly higher in the past quanto1 of the world	independent predictors of DFS
1	1
the current [UNK] [UNK] [UNK] in the treatment of gastric cancer	the key epidemiology concerning cardiovascular risk
to the major [UNK] [UNK]	significant predictors of the HRQoL in the multiple regression analysis
[UNK]	with adherence to medication treatment
the risk of gastric cancer	the risk of developing chronic respiratory symptoms in children
the [UNK]	to tracheostomy
to treat lung cancer	for the increased CVD risk in women with type 1 diabetes
ndre impact higher levels of ee	in EE
the most important role of the disease	an important role in exploring new ways of diagnosis
to treat [UNK]	for intermittent positive pressure ventilation
to improving the risk of developing complications	to improving the lifestyle of individuals through legal provisions
the [UNK]	ongoing risk of breast cancer recurrence , distant metastasis , and death
that [UNK] [UNK] [UNK] [UNK] [UNK] [UNK] [UNK]	that relative to patients with bipolar disorders have double the risk of T2DM
that [UNK] may be diagnosed in [UNK]	increased LDL - C with deteriorated HbA1c
with the [UNK]	by photodynamic therapy
that the current [UNK] of cardiovascular disease	the pathogenetic process
a number of patients with [UNK]	obesity
the most important health problem	already present in childhood
on the need for new treatment of breast cancer	on the cognitive complications of their relation with the characteristics of comorbidities Then
[UNK]	reflecting improvements in treatment
a significant effect	evidence for a causative role for clonal haematopoiesis in cardiovascular diseases
a major impact on the health of breast cancer	even at relatively low levels of physical activity
[UNK]	to define a subpopulation at increased risk for colorectal cancer
the risk of lung cancer	the most evidence for glycemic control
in the [UNK] [UNK]	in select populations such as pregnant T1D
the same [UNK]	yet commercially available in clinic setting
by the disease	to miRNA expression
to the risk of lung cancer	to greater understanding of epidemiology of T1D
[UNK] [UNK]	as a tool
[UNK]	the assumption that dietary or plasma alpha - linolenic acid levels are positively associated with prostate tissue alpha - linolenic acid levels , and measurement errors of dietary , plasma and red blood cell alpha - linolenic acid levels
[UNK] [UNK]	no significant effect on the coordination of swallowing
[UNK]	membrane structure
by the disease	by cardiovascular disease
with the [UNK]	with an increased risk of both depressive symptoms
a role in the development of this disease	an increasingly central role in management As more is learned about the genetic basis of cardiovascular disease
likely to be effective to treat the disease	able to detect cancers soon ( immunochemical tests , other methods virtual colonoscopy etc.
in the [UNK]	with canonical signaling pathways
the same mutation in the prion gene in quanto1 families	individual responses to therapeutic outcomes
a [UNK] [UNK] [UNK] [UNK] [UNK] [UNK]	spirometry
a role in the development of colorectal cancer	an impact on endothelial myocardial contractility
a significant association between polypharmacy and all cause of the society is associated with high risk factors	an association of exposure to ambient air pollution , household air pollution from cadmium with multiple cardiovascular disease outcomes , including coronary heart disease
the most common cause of cancer death	a complicated disease treated with multimodality therapy
to the disease	to lung cancer
a [UNK]	a major interest in the radiotherapy treatment of gastric cancer due to a number of factors in the present
[UNK]	lessening of cardiovascular symptoms , enhanced quality of life and , for survivors of acute myocardial infarction
to the patients with chronic respiratory diseases	for cancer ever
a major health risk factor for gastric cancer	an overview of female breast cancer statistics in the United States , including trends in survival In this article
a major health issue in most frequently	even further progress As the world 's population ages
the disease of the most important health factors	cardiovascular risk
the current state of the clinical trials of [UNK] therapy for the immune system	recent efforts to understand the causes of related efforts
with quality of life	against the development of diabetes , possibly through the amelioration of insulin sensitivity
[UNK] of the human body	gastric cancer subtypes
important	important for therapy
the most important role of the development of lung cancer	how to analyze high - dimensional datasets of other variables
that the patients with chronic respiratory diseases	that it may be efficacious in HIV - infected smokers
the most [UNK]	an emerging epidemic of type 2 diabetes
on the immune system	on the therapy
a significant effect	a certain proportion in the clinic
with the [UNK]	with atherosclerotic plaques long
in the united states	in some parts of Belgium
the treatment of type 2 diabetes	a significant association with cardiovascular disease events
by the public health institute of [UNK]	by the Georgian Respiratory Association
[UNK] [UNK]	radiotherapy
the most important scientific research of the disease	MVV
[UNK]	not only diet
the current [UNK] of cardiovascular disease	several of the key issues
the information on the use of the [UNK] of [UNK]	to identify national research groups
the most [UNK]	in almost every step of gastric carcinogenesis
that the risk may be decreased with a high intake of vegetables	that the risk may be increased with a high intake of various traditional salt - preserved foods
to provide the current multidisciplinary approach	to assess the present and new management strategies of IBC
with the disease	with A1C
a major impact on the [UNK] of gastric cancer	a valuable Currently
to provide the child with the problem of oxidation	to model mortality rates by age
critical to mortality in africa	critical to morbidity in Africa
[UNK] [UNK] [UNK] [UNK]	to the use of both devices
the risk of gastric cancer	the clinical utility of future tissue biomarkers in the diagnosis of colorectal cancer
the same number of patients	between countries in Europe in home treatment of chronic respiratory disease
from the presence of [UNK] agents [UNK] in [UNK] [UNK] [UNK] in [UNK] [UNK]	from adipose tissue
an important role in the development of lung cancer	a great clinical challenging problem for gastric cancer patients
to be [UNK] in the [UNK] of gastric cancer	to be carried out with an open mind
the risk of gastric cancer	a multi-sector strategy that reduces cardiovascular risk factors
a major cause of the disease	the first cancer in which immunotherapy vaccine was approved by FDA in 2010 named Sipuleucel - T. No new immunotherapies have been approved since as phase 3 trials did n't show any improvement in overall survival ( OS ) especially with immune checkpoint inhibitors
the gap between cardiovascular risk factors	the gap between cardiovascular risk factors
to the disease	to the initiation
[UNK]	the classic staging method for colorectal cancer
[UNK]	insulin - dependence
important	relatively infrequent
[UNK]	Once diagnosed with T2 DM
[UNK] [UNK]	as significant in the prevention of Type 2 diabetes
to treat [UNK] patients with [UNK]	to tackle the issues of prevention
that the current [UNK]	that fiber 's modulation of insulin resistance deserves additional attention
a [UNK]	eight sessions of PRECEDE model - based self - management education program
the same length as levels of [UNK]	the findings
in the past	in this study
environmental risk factors	occupational chronic lung disease
as a major impact on cardiovascular disease	successful for adenocarcinomas So far
the [UNK] [UNK]	mortality rate
a	59
[UNK]	independent predictive factors for progression to castration - resistant prostate cancer
the [UNK] [UNK]	exploration of the experiences of adolescents with type 1 diabetes mellitus
the most important [UNK]	still elusive
that the most important ongoing of the national causes of the disease	a 20 % mortality rate reduction in patients
a [UNK] immune system	correlation with asthma
the most common cancer cause of cancer death	the leading cause of cancer death in China , with 733 610 thousands deaths in 2015
to the risk of lung cancer	to earlier detection
the current state of the clinical trials of [UNK] drug for patients	the current recommendations for diabetes self - management education including assessment for diabetes distress
in [UNK]	significantly higher in the diabetic group compared with controls ( respectively
the most common cause of cancer death	the leading cause of cancer - related death
in the past 20 years on one of age of six months	in both areas
in the most frequently diagnosed cancers	candidates for definitive treatment
the pathophysiology of specific to breast cancer risk	the relationship
to the disease	nowadays surgery
a significant effect	high levels of IL - 6
10 million animal and 1	predictive power to that of chronological age
that the current canadian diabetes association clinical practice guidelines are insufficient to provide a basis for health care	that several common mechanisms lead to an increased cardiovascular risk
the treatment of type 2 diabetes	the benefits maintain these levels while avoiding hypoglycemia ( < 70 mg % ( 3.9 mmol / l ) ) in the older population
for [UNK]	for use in diagnosis
gastric cancer	therapeutic resistance
that the [UNK] is a major impact of gastric cancer	as barriers to reducing the deleterious societal impact of prediabetes In both cases
the same time	to standard chemotherapy regimens
a major impact on the management of gastric cancer	a key role in advancing medical knowledge promoting economic growth in Europe
a disease	available at the same rate for all countries or for different ethnic and socioeconomic groups
[UNK]	very common among AN children
to treat dogs with a [UNK]	us valuable information to fully understand the process of lung cancer progression
able to detect presence in both [UNK] and [UNK] to [UNK] [UNK]	prevalent in adults
a potential for the future of the patients with a healthy lifestyle	a practical review about this disease providing answers to helping them to be by the patients for their benefit throughout their illness
in [UNK]	NPPV
important	in order In this article
lower to [UNK]	liver disease as an end - organ complication of T2DM
the [UNK]	a genetic association with thoracic aortic aneurysms
important	important for effective treatment
the most important role of [UNK] in the development of cancer	morbidity in patients with diabetes mellitus
as the us dollar fell against the german mark making it cheaper for investors using other major currencies to buy	in both conditions
important	more effective in promoting an increase in Maximal oxygen consumption there is no difference in the control of lipid levels between the two types of exercise
on the need of [UNK]	on diagnosis
unlikely	0.97
to [UNK] [UNK]	aortic regurgitation
a disease	more evident in type 1 diabetic patients
the current state of the information of the new [UNK] [UNK]	on important developments in the treatment of breast malignancies
mortality rate in the past 10 years	hypoxic treatment
available in many years	by changes in the human microbiota
important	by colleagues
a significant effect	rich opportunities for therapeutic intervention
the most important ongoing research	the assumption that implementation of IFSPs for the cohort of children with chronic mechanical respiratory support needs in EIPs is challenging
the most important role of the development of lung cancer	diagnosis practices
both sides of the last decades	a neuropsychological examination of the brain
in the us	in cirrhotics
to the current multidisciplinary approach	to a decline in gastric cancer incidence in low incidence countries
the most important component of the time of patients	often
a higher risk of developing [UNK]	The good cardiorespiratory fitness
the quality of life of life of life	nurses to understand how to provide accurate information regarding management
to the management of type 2 diabetes	to greater understanding of epidemiology of T1D
the effect of [UNK] on the development of t2 dm	moderate increases in physical activity
the [UNK] [UNK]	cardiovascular disease
the current state of the clinical trials of [UNK] drug for patients	the basics of the effects of genomic advancements on future breast cancer survival
[UNK]	continued clinical research
a significant effect on the health of the health of the [UNK]	in all signals
for patients	focus national leadership
the risk of gastric cancer	when diagnosed with diabetes
the same disease	from studies of the application of targeted therapies such as growth receptor antagonists
a significant association between polypharmacy and all cause of the society is associated with high risk factors	an association of exposure to ambient air pollution , household air pollution from cadmium with multiple cardiovascular disease outcomes , including hypertension
[UNK]	in contrast to the overall impact of the renin - angiotensin system in cardiovascular disease
the biological clinical applications of the new method of [UNK] [UNK]	the biological characteristics in accord with three important criteria of high sensitivity ( high specificity ) , clinical utility , especially a new method of ligand - targeted PCR ( LT - PCR ) that showed a high sensitivity of 67.2 % in stage I lung cancer
a major cause of cancer related death	a leading cause of cancer death
the most important ongoing role of lung cancer	relevant to these areas of study
the risk of developing complications	in clinical trials
a disease	a complex disease that requires meticulous attention from healthcare patients
a significant effect on the health of the health of breast cancer	activity in the treatment of prostate cancer
the risk of gastric cancer	telomere shortening
a disease	a sufficient cause for its development
the most important in the us	still the most effective for women with non-dense breast tissues respectively
to treat dogs with a risk	by factors such as age , gender , cardiovascular risk factor status , drinking type of alcohol
predictive of lung cancer	the incidence of major macrovascular events
the evidence of a literature review on the clinical [UNK]	three cases of carcinoma of the breast in men with a review of the literature on risk factors
important for the disease	minimally invasive
to the [UNK] of [UNK]	to find new markers for prognosis of breast cancer
the same disease	procoagulation
a [UNK] immune system	perhaps the greatest interest for gene - based therapeutic interventions
a disease	a chief concern for healthcare providers in America
in the pathophysiology of specific cardiovascular diseases in the [UNK]	in more detail in the subsequent chapters of the companion book
the current [UNK] [UNK] [UNK] in the past population	the current state - of - the - art regarding decisional aids
rise	a predictor of all - cause mortality in the general population
the risk of gastric cancer	the association between markers of chronic infections in relation to a variety of clinical and subclinical cardiovascular disease outcomes During the last 2 decades
the most important component of the most important clinical research	cardiovascular risk
a higher risk of gastric cancer in men with [UNK]	that intensive treatment of type 2 ( non-insulin-dependent ) diabetes mellitus , with sulphonylureas or insulin , significantly reduced microvascular complications but did not have a significant effect on macrovascular complications after 10 years
for research	all review articles in databases including Scopus
the [UNK]	completeness
to the [UNK] of [UNK] [UNK] [UNK]	from this literature
still	at the primary site
for gaseous pollutants	for influenza outbreaks
a major [UNK]	the most prevalent complication among patients with T2DM
a major cause of [UNK]	by absolute lack of insulin secretion
the most important ongoing research	the effects of a mobile navigation program on uncertainty
[UNK]	much higher in current smokers
the current [UNK] of the clinical trials of [UNK] [UNK]	their own recommendations in relation to funding policies
the risk of gastric cancer in men after [UNK]	the cost - effectiveness of screening in populations at moderate risk
that the current [UNK] is associated with [UNK]	the association of chronic hyperglycemia with the development of diabetic complications
the current [UNK] [UNK] [UNK]	on the rationale for exercise training
the risk of gastric cancer	oxygen
a disease	in this patient
a game	an active role
the current state of the clinical trials of [UNK] drug for patients	type 2 diabetes
a [UNK]	2.3 times higher in the CRD group ( 29.7 DID
to the patients with t2 dm	preventive strategies more acceptable for the population
the disease	108 246 randomly chosen individuals
likely to be diagnosed with lung cancer in patients	behind that of women
the current [UNK] of cardiovascular disease	an opportunity to examine late - onset autoimmune diabetes within the context of a family history of T1D
the [UNK] of the treatment of time	these drugs with ketogenic diets
[UNK]	38 % to 43 % more likely to die from colon cancer
with the disease	with cancer
in the [UNK]	inconsistent
with the disease	between patients with TNBC and non-TNBC in each stage
a role in the development of gastric cancer tissues 0	a major role in gastric carcinogenesis
the current [UNK] [UNK] [UNK] [UNK] [UNK]	interventions proven to reduce adverse cardiovascular events such as smoking reduction of hyperlipidemia
to the treatment of type 2 diabetes	to 7 % to 10 % of breast cancer caused mortality
in [UNK]	women
the treatment of [UNK]	whether early dietary changes , such as increased intake of micronutrients that improve insulin sensitivity , affect biomarkers
the current knowledge on which to the potential for selecting the best possible available history of breast cancer	the related content of exercise
an important role in the pathogenesis of [UNK]	"""""""""""""""""""""""""""""""a wealth of """""""""""""""""""""""""""""""" omics """""""""""""""""""""""""""""""" data ( proteomic ) to increase the number of clinically validated biomarkers in order"""""""""""""""""""""""""""""""
the [UNK] of the [UNK] of [UNK]	an important challenge for caregivers
the most important role of lung cancer	the relationship between other aspects of glucose management and CVD risk by sex in type
a [UNK] [UNK]	an overview of potential future directions for care
by the presence of [UNK] agents [UNK] in [UNK] disease	by a significant deleterious economic impact at the level of households
to treat the disease	already
the most important [UNK] [UNK] [UNK] [UNK] [UNK]	the epidemiology of lung cancer in China
to the development of lung cancer	to the development of respiratory disorders
[UNK]	lots of benefits for cancer patients
the most important committee	to a heterogeneous group of disease states
to the [UNK]	to various definitions of prolonged respiratory support
the need for a new treatment of type 2 diabetes	risk
as [UNK]	extensively
the most important role of lung cancer	for T1 D predisposition
by the disease	if an infant remains oxygen dependent beyond 36 weeks usually
environmental risk factors	environmental chronic lung disease
the [UNK] [UNK] [UNK]	future directions
with the disease	with emergency hospital admissions for respiratory diseases in Hong Kong independent of gaseous pollutants
to the disease	in vascular inflammation
a [UNK] [UNK] [UNK] [UNK] [UNK] [UNK]	alcohol consumption documented
[UNK]	at increased risk of GC
the most [UNK] [UNK] [UNK] [UNK] [UNK]	vital to the effectiveness of influenza prevention efforts
the [UNK]	rarely feasible
[UNK]	second - hand smoking , radon exposure , occupational exposure to carcinogens
important in the literature	steroid hormone profile
in 2010 in the united states	in low - and middle - income countries now
[UNK] immune responses	inconsistent care coordination contributing to the social isolation of their families
the disease	the efficacy of common therapies for chronic respiratory disease
the [UNK]	any disagreements
a [UNK] [UNK]	by a radical resection including an adequate lymphadenectomy
to the most important health problem	to macrovascular complications
to the disease	to several complications , including lower extremity amputation
the current state of the clinical trials of [UNK] drug for patients	the current recommendations for diabetes self - management education including medical nutrition therapy
the [UNK]	increase
a significant effect	further study
the [UNK]	great advances in understanding disease susceptibility
a major cause of cancer	a common complication of chronic respiratory disease
in the us	small cell lung cancer
a good time	through a transition process due to changes
to treat dogs with risk factors	until micro - complications arise
available	informative
from animal models of [UNK]	from cancers
the patients with a high risk of lung cancer	them with healthcare professionals
the [UNK] [UNK]	the management of diseases of the breast - breast cancer in particular for the next 30 years
quanto1	high compared to general colorectal cancer
still	probably through promoting the proliferation of gastric cancer
a major cause of cancer related death	preventable
[UNK]	a valid biomarker for early detection of gastric cancer
to the [UNK] of [UNK] in the [UNK]	to malignancy of tumors
to [UNK] [UNK]	from the data
with the disease	with early cancer diagnosis
[UNK]	Four
the [UNK] [UNK] [UNK] [UNK] [UNK] [UNK]	expiratory volume in 1 second
the potential to improve t2 dm self management	that the improvement in breast cancer survival in men has fallen behind that of women
cancer risk	ethnicity due to physiological insulin resistance
with [UNK]	in the future
to provide the child with the skills necessary to manage diabetes over a lifetime	to determine clinical effectiveness of its effect on the level of healthcare services as an indicator of direct medical costs
the current [UNK] of cardiovascular disease	the psychological aspects of managing patients with breast cancer
a significant association between the depression of the medication primary breast cancer	areas of consensus in knowledge
the [UNK]	the well - being of youth with T2 DM
the [UNK] of the [UNK] of the [UNK] of [UNK] therapy	associations between viruses and the development of type
the patients with type 2 diabetes	in cardiovascular disease risk management
the current [UNK] [UNK] [UNK] in the treatment of gastric cancer	current primary care recommendations for post-breast cancer care
to the major health problem	to the phenomenon of stage migration with more cancers
the [UNK]	at the end of 1992 by means of a questionnaire
that the patients with chronic respiratory diseases experiencing depression [UNK] for [UNK]	that high dietary intake of n - 6 fatty acids , rather than reduced n - 3 intake , may have an adverse effect on lung health
with the [UNK] of [UNK]	in the pathology report to indicate the extent of the disease
a higher risk of developing [UNK]	airway hyperreactivity Fourteen days after SM intoxication
