a higher risk of gastric cancer in men	potentially additional treatment options Finally
both [UNK] and the most important role of the development of [UNK]	an unprecedented change in our understanding of the heterogeneity of breast cancer metastasis Recently
the most important advances in the literature	the protocol in 2017
the current [UNK] of cardiovascular disease	some of the plausible biological mechanisms
the same [UNK]	their significance in lung cancer diagnosis
the disease	with increased risk
to be [UNK]	the important information about the biology
the most common cancer cause of cancer death	the most common , non-dermatologic cancer in men
the assessment of the relations between the effectiveness of lung cancer	the assessment of the relations between health outcomes
the most important health problem	high in > 1 domain
important	likely to benefit HIV - infected smokers
[UNK] of the [UNK]	as the ratio of DALYs from communicable diseases to those from injuries
the risk of gastric cancer in men in the us	epidemiological aspects
[UNK]	CKORC1
the [UNK]	patients ' metabolic control
the [UNK] [UNK] [UNK] in the [UNK] of the [UNK] [UNK]	the genetics
[UNK]	1.93
097	1.01
these issues	these four types of polyp cancer syndromes
the same	to a minimum by the use of axillary sentinel lymph node excision now
a major component of the most important things	this presentation of type 1 diabetes mellitus more common
to the patients with chronic respiratory diseases	for testing
important	available
in the [UNK]	to be disregarded
on the need of [UNK]	on prevention
with the disease	with respiratory hospitalisations in individuals with normal spirometry without known airway disease
the current [UNK] [UNK]	enormous potential for the management of symptom clusters
[UNK]	18 % of the global population
a number of immune abnormalities in lung cancer	an advanced tumor stage
progress is on the knowledge	to the general population
for peer reviewed articles using the [UNK] operators	for peer - reviewed articles using the following search terms
a [UNK]	low in India
1 to improve detection of risk of type 1 diabetes 2 to improve staging of progression 3 to perform smaller	1 ) to improve detection of risk of type 1 diabetes , ( 2 ) to improve staging of progression , ( 3 ) to perform smaller , shorter , an increased number of prevention
the most common cause of cancer death	a substantial contributor to young adult
the need for a new treatment of breast cancer	relatively little attention
[UNK]	improvements in treatment
the risk of gastric cancer	applicability to patients
the same [UNK]	novel therapeutic combinations
as a major component of the [UNK] of the most important component in the evaluation of patients	in those of intervention group after the education program
[UNK]	to cardiovascular disease often
among the most important	cardiovascular disease
the risk of lung cancer	when resistance arises , would almost certainly improve survival due to these therapies
by the public health institute of [UNK]	by androgens
in the pathogenesis of type 2 diabetes	in the pathogenesis of various lung diseases including asthma
[UNK]	less clear
the [UNK]	the complexity of the experience of symptom clusters from the perspective of the patient
[UNK]	thorough radiologic imaging , which allows subsequent surveillance for disease recurrence
a significant effect	rates of disturbed eating behaviors and clinically significant eating disorders than their nondiabetic peers
on the need for a new method of clinical practice	on expanding treatment options through development of novel antibody - drug conjugates
respectively 40 15 income in burkina faso	respectively 40 % , 15 209 % of per capita income in Guinea
important	present transiently in the blood of affected individuals
to the development of [UNK]	throughout
[UNK]	52 797 adults aged 18 years
important clinical tools in the treatment of gastric cancer	in prostate cancer frequently
a [UNK]	responsive to pulmonary rehabilitation in chronic respiratory disease patients
lung cancer	the burden of cardiovascular disease in schizophrenia
[UNK]	SLCO1B1
the [UNK] of [UNK] [UNK] [UNK]	the role of core pluripotency transcription factors OCT4 as adverse prognostic factors in colorectal cancer
in the literature	in biologic properties of distal segments of normal fetal colonic epithelium
the risk of gastric cancer	major differences in the amount and location of inflammatory cells in distinct colorectal tumor types
that the patients with chronic respiratory diseases experiencing depression [UNK] for [UNK]	no statistical significance of the two aforementioned tests
a positive impact on endothelial function	treatment
a [UNK]	under - treated in those without chronic respiratory disease
the most important	an important mechanism to prevent pulmonary aspiration
the most important component of the new [UNK]	active against breast cancer
to the disease	of paramount importance to improve patient prognosis
[UNK]	absent in jute workers
a disease	mainly chemoradiotherapy while patients are prone to drug resistance
to the most important ongoing health problems	to the understanding of lung cancer screening
to provide the child with the skills necessary to manage diabetes over a lifetime	to evaluate the evidence
an important role in the development of lung cancer	an realistic goal for preventing type 2 diabetes in susceptible individuals
a [UNK]	irrespective of the differences often
in [UNK] [UNK]	in diabetes
the [UNK]	stories
[UNK]	by Th2 cytokine generating T - cells
important in the development of lung cancer	important for developing new targeted interventions for colorectal cancer
to [UNK]	to T
the most important role of the development of lung cancer	when metastases have occurred
important	similar to estimates
in [UNK]	comparable to outcomes in PTA
that the risk may be decreased with a high intake of vegetables	that the risk may be increased with a high intake of salt per se
a [UNK]	partly due to the high levels of biological heterogeneity
the same disease	the association with increased mortality
the [UNK] of the [UNK] of [UNK]	a castration - resistant prostate cancer
[UNK]	utilization of glucose by aberrations with the onus on Gluconeogenesis
lung cancer risk in hiv infection	disease susceptibility
that the most frequently diagnosed cancer in the cancer in the united states	that females had activation in more brain regions
in the united states	in some parts of Spain
[UNK]	significantly the next years
[UNK]	rate of disease progression
the risk of lung cancer	adverse effects caused by smoking
[UNK]	RR or HR as effect estimate
hundreds of years	> 80 years
the effect of [UNK] in the development of cardiovascular disease	potential morbidity
the treatment of type 2 diabetes	these myths
a major impact on glycemic control of individual	important therapeutic questions regarding conventional therapy for therapy
[UNK]	activating adenosine monophosphate - activated protein kinase pathway
to the current treatment of type 2 diabetes	to gastric cancer
male	twice as common in type 2 diabetes as in the general population
the evidence for the study	the current role for ( chemo
the most important [UNK]	still under evaluation
[UNK]	hyperandrogenism seen as dyslipidemia
important	one of the rarest breast cancer ( BC ) , representing the majority of BC in childhood
to the [UNK] of [UNK] in the [UNK]	to the tumor evolution
[UNK]	more modest
the current [UNK] [UNK] [UNK]	the varied use of definitions
[UNK]	positive effects on psychiatric outcomes At the same time treatment of T2 DM
the [UNK]	oncogenomics
the most common cause of cancer death	the most common cancer among women
the most important [UNK]	pathologic complete response after neoadjuvant chemotherapy
for the most of the decades	as an accessory organ
a [UNK]	a common disorder in the United States
the current [UNK] effect on the quality of life of diabetes	the effects of testosterone on the prostate of exogenous testosterone in men with a history of prostate cancer
as well	From these studies
[UNK]	the potential to restore the physical functioning in patients with CRD whereas medication has much more narrow effects
to treat the disease	that the gastric cancers were all of the diffuse type
the same	the respiratory system
a major health issue in most [UNK]	one of the highest heritabilities of all major cancers
for the past decade	for age in the SEER data
to improve health outcomes	in tissues
a high number than those	energy to the host from the ingested food
a higher number than 1	unique biological characteristics upon them , such as enhanced stability over linear RNAs.Areas covered
important	elusive
the patients with high risk of developing [UNK] [UNK]	a better understanding of the molecular interactions within cancer cells
to be [UNK] in the [UNK]	genetic testing to assess the risk of recurrence of breast cancer
[UNK] [UNK] [UNK] [UNK]	as an initiator of the autoimmunity
the risk of gastric cancer	low - grade inflammation
patients with t2 dm	children with T2DM In many communities
[UNK]	these variants
for each year	in those under the age of 50 over the last 20 years
the most important ongoing research	hemodynamic information from an implantable PA pressure monitor
to be useful	to a decrease in aerobic fitness
a major component of the most important [UNK]	an early phenomenon partly related to obesity , pancreas beta - cell function declines gradually over time already before the onset of clinical hyperglycaemia.
to examine the evidence	to systematically review ACP practice in chronic respiratory disease , attitudes of patients related to engagement in ACP
for the last years	as effective in Western countries
beneficial effects on reducing health risk of life	promotion of a healthy lifestyle including sufficient physical activity
lung cancer risk in patients	cancer control
the [UNK]	their usefulness in randomized trials
trionyx [UNK]	tomography screening by 20 %
to [UNK] [UNK]	respiratory symptoms
in [UNK] [UNK]	for analysis
the most important [UNK]	to be obtained
by the presence of [UNK] agents [UNK] in [UNK] [UNK] [UNK] in [UNK] [UNK] [UNK] [UNK]	by the lack of therapeutic regimens capable of generating durable responses in the setting of extreme tumor heterogeneity on the cell biological levels
their patients	women 's awareness of this disease
[UNK] [UNK]	21.3 months
with [UNK]	with tobacco smoking
in the last year	from sessile adenomas
the most important role of the disease	a pivotal role in providing holistic care
by [UNK]	by questionnaires as were smoking occupational history
ndre impact higher levels of ee	in EP
a [UNK]	one or more abnormal findings on FOT
the same time	futile unless other factors that promote cardiovascular disease also are modified
to the same level of the most frequently	to the use of neonatal ventilation
the association between polypharmacy and all cause of all cause of the [UNK]	the association between polypharmacy and all - cause of drug - drug interactions
a number of immune abnormalities that [UNK] in the disease	that financial incentives increased weight loss of a two choice architecture modifications had mixed effects in encouraging completion of tests
on the use of [UNK]	to the need for further research
in the treatment of type 2 diabetes	to improve the treatment of this disease
in the us	concerns about increasing health care
the most important role of cancer	it essential for physicians to be aware of risk factors ,
a major cause of death in adults	a major cause of early mortality due to atherosclerosis
in the most important treatment of gastric cancer	in high risk areas such as East Asian countries
a significant effect	some human trials to be carried out with encouraging results
the role of [UNK] in the [UNK] of [UNK]	recent clinical findings
in the past 20 years on account of its clinical application advantages such as [UNK] invasive visual or [UNK]	therapeutic strategies
critical to mortality in africa	some of the factors responsible for improper entrainment of the clock
the most common cause of cancer death	the end result of the interplay of protective factors
the current [UNK] of [UNK] [UNK] [UNK]	a new era in cancer therapy with impressive therapeutic benefits
the [UNK]	the risks for asymptomatic type 2 diabetes
the current [UNK] [UNK] [UNK] in the treatment of gastric cancer	typical treatments based on stage
a critical role in the development of lung cancer	an integral role throughout the trajectory of illness for women with lung cancer
to the [UNK] of the treatment of gastric cancer	in scope
in the past	in the continental United States
[UNK]	at risk for a variety of problems at school
[UNK]	hereditary
the disease	2
significant	currently closer to 80 % in Poland
the most important role of the disease in the development of gastric cancer	overwelming - diabetes can be prevented or delayed in high risk population through lifestyle modification or pharmacological interventions
the same [UNK]	as gluten exclusion
a number of patients with [UNK] [UNK]	modest survival improvement for patients with non-small cell lung cancer
to [UNK]	a poor prognosis
[UNK]	more than 800000 individuals
a number of patients with a small number of immune cells	long
a significant effect	a chance to detect early stages of the disease
the risk of gastric cancer	the pathogenesis of its cardiovascular complications
on [UNK]	in these trials
[UNK]	17 scientific papers
with the disease	with both cellular immune changes in the peripheral blood months
[UNK]	1/4 of the population on the globe
into five categories	"""""""""""""""""""""""""""""""into the three themes of """""""""""""""""""""""""""""""" negative feelings about having diabetes , """""""""""""""""""""""""""""""" """""""""""""""""""""""""""""""" personal barriers"""""""""""""""""""""""""""""""
on the [UNK]	upon the data from individual review article
of the presence of obesity	of a combination of the pepsinogen ( PG ) method
with type 1 diabetes	with weight loss
the current [UNK] [UNK] [UNK] in the treatment of gastric cancer	the role of ncRNAs in gastric cancer metastasis
important ongoing studies with the [UNK] of the national health coverage of this year	novel insight for establishing more effective therapeutics Recently
the same	0.42
[UNK]	major inhibitions which are also current challenges for containing the disease
the potential for identifying specific characteristics	recent advances in the treatment of metastatic castration - sensitive prostate cancer
[UNK]	a hermeneutic phenomenological approach
in [UNK]	the primary problems setting the stage for a lifetime of health complications for many of today 's youth
by the disease	by multiple genetic loci in interplay with environmental factors
with a higher risk of gastric cancer	with breast carcinogenesis
the most frequently	a wide array of cell subsets with different capacities of engraftment
in the past 20 years on account of its clinical application advantages such as [UNK] invasive visual or [UNK]	even during childhood
the association between polypharmacy and all cause of the development of cardiovascular disease	miRNAs as strong circulating biomarkers with high diagnostic In cardiovascular disease
us [UNK] for [UNK] representing respectively 40 15 income in burkina faso	US$ 82.99 for salbutamol , representing respectively 40 % , 15 209 % of per capita income in Guinea
a major cause of the [UNK] of [UNK]	the only effective treatment option for patients with early stage tumors Currently
to provide the child with the skills necessary to manage diabetes over a lifetime	to identify any correlation between their presence
[UNK]	their role in resistance to prostate cancer progression
with a high risk of developing complications	with an increased incidence of cardiovascular disease
to the development of lung cancer	to a decline in gastric cancer incidence in high incidence countries
the most [UNK]	those individuals
the most important role in the development of lung cancer	with other guidelines In this paper
with [UNK]	according to common syndromes bradyarrhythmias
on the need for a new approach	on what is known about the role of socioeconomic status
a disease	homogeneous exposure groups
a role of the [UNK] in the [UNK] of the [UNK]	proof - of - principle
[UNK]	despite androgen blockade
the association between polypharmacy and all cause of the development of cardiovascular disease	that the expression of several circRNAs in tumors were abnormal
[UNK]	while designing future diabetes prevention strategies
the same [UNK]	to measure the coagulation time
to explore the indirect influence of partners beliefs on diabetes distress at follow up	to assess the readiness of health facilities for cardiovascular diseases
the treatment of type in this article	the clinical presentation In this article
significant insight into the disease	the potential to improve atherosclerotic cardiovascular disease outcomes in women
type 1 diabetes	risk
important roles in the accumulation of genetic alterations in lung cancer cells	in the development of T2D
beneficial in high risk group	sufficient in this particular ethnic group
important [UNK] [UNK]	different clinical COPD phenotypes
a [UNK]	the mode of delivery of these interventions in chronic respiratory disease
at higher risk for cardiovascular disease mortality	80 %
the treatment of type 2 diabetes	further refinements in taking germline
the most important role of the [UNK] of the [UNK] [UNK] in the [UNK] of [UNK] [UNK] [UNK] [UNK] [UNK]	the significance of simple measures such as thorough history
to the development of chronic respiratory diseases	to cardiovascular disease pathophysiology
to provide the child with the skills necessary to manage diabetes over a lifetime	to diabetes care improvement in the context of personalized medicine in the near future
with [UNK]	with type 1 diabetes
the [UNK]	results
the most important [UNK]	highest in low - income regions of the world
a [UNK]	a prerequisite for the successful clinical application of these targeted drugs
to eat	in the cat
the [UNK] of the community in [UNK]	its aggressive complex biology , all of which pose real challenges for patient education
on the need for a new model	on topics including : recognition of tumor heterogeneity immunotherapeutic approaches to target
the most important role of lung cancer	components that improve muscular strength
in the us	on the evidence available from female breast cancer
the disease	metrics for success underscores the importance of cardiovascular disease surveillance systems for the acquisition of information sufficient to support evaluation
the [UNK]	malignancy
for the future of the disease	for diabetic patients with acute myocardial infarctions
trionyx [UNK]	tomographic scans for small peripheral adenocarcinomas
the most important role of [UNK] in the development of cancer	mortality in patients with diabetes mellitus
patients with chronic respiratory diseases	their child
in the past 20 years on account of its clinical application advantages such as [UNK] invasive visual clinical the standard	their disturbed eating behaviour positively initially
by advances in [UNK] enabling new insights into disease susceptibility	by advances in human genetics enabling new insights into progression
from [UNK]	to examine the associations between maternal respiratory diseases and abruption in the United States
[UNK]	to be identified
on the use of [UNK]	on the latest advances in basic
the [UNK] of [UNK] [UNK] [UNK] [UNK]	the relationships between depression , antidepressants and cardiovascular disease
[UNK]	to primary genetic factors
to the disease	to several complications , including musculoskeletal impairments
in [UNK]	from 1 January 2002 until 1 January 2011
to be [UNK]	to be limited to the morning
to the disease	respiratory muscle strength in neck pateits
a disease	lipid metabolism impaired insulin secretion
the same disease	familiar with the rationale behind biologic therapies
with [UNK]	with inflammation , thrombosis as well as in CVD development
a significant risk of the onset of gastric cancer	that the risk may be decreased with a high intake of vegetables
to treat dogs with a [UNK]	to treat men with breast cancer often
in the [UNK]	In the past few years
the federal government	effectiveness
the risk of lung cancer	the incidence of macrovascular events in these patients
the opportunity to develop [UNK] therapy for early gastric cancer	that nutrition may play both a protective role in the development of colon cancer
to treat dogs with a disease	CRD
in the most common cancer	in post-transcriptional processing
the effect of [UNK] on the [UNK] of [UNK]	more choices in this field
in [UNK]	by PSMA PET - CT imaging
a [UNK]	some other detrimental effects on the major blood vessels
with their [UNK]	with type 2 diabetes
our lives	"""""""""""""""""""""""""""""""a certain """""""""""""""""""""""""""""""" threshold"""""""""""""""""""""""""""""""
[UNK]	annually in the USA
at higher risk for cardiovascular disease	at those with local recurrence
to provide the current understanding of the possible treatment of type 1 diabetes	to discuss the differentiation between MPLC
a [UNK] [UNK]	a gross underestimation as reported from biopsy - proven symptomatic cases
mortality	due to effective cancer screening measures
obvious	available in 33 patients in each group for analysis
with quality of life exercise in prognosis in various conditions including chronic obstructive pulmonary disease	with quality of life , exercise ( in ) prognosis in various conditions , including chronic pulmonary hypertension
by the presence of [UNK] [UNK]	by 2 pathogenic defects
with the [UNK]	with an increased risk of both depressive symptoms
both [UNK] and the most recent statistics on the risk factors	by national organizations , health services , commercial companies or hospitals
the [UNK]	sequencing of approved therapies while searching for predictive biomarkers
with the [UNK] of [UNK]	with better glycemic control
to the [UNK] [UNK]	to greater risk of high BG
to [UNK] [UNK]	to improvement in the prognosis
the [UNK] of the most important treatment of the american men	A sleep
to treat the disease	on the basis of attribution in case series , incidence rate ratios , or attributable fraction within an exposed group For the other conditions
to detect the disease	to distinguish clear differences such as deciding treatment or showing a peculiar characteristic
different [UNK]	uncommon
[UNK]	Pacific Islander women to obtain timely breast cancer screening when they provide culturally appropriate education materials on breast cancer
that compared with the men in the past population	these new technologies / strategies
the current state of the clinical trials of [UNK] drug for patients	the basics of genomics
a higher risk of developing [UNK] [UNK]	about the two - thirds of the patients die from original disease within 10 years
a number of patients with [UNK]	three follow - up surveys after receiving results
to the disease	to its detection
with a [UNK]	usually in locally advanced stage
quanto1 [UNK]	as an independent risk factor for the development or progression of the other
the most important ongoing research	an unmasked , randomized controlled trial at a medical check - up center in Japan
with the disease	in colon cancer due to unclear reasons at this point of time
a reduction in [UNK]	similar risk patterns
the most important role in the development of cancer	in constant modification
the same [UNK]	exercise tolerance
a higher number than 1	unique biological characteristics upon them , such as enhanced stability over linear RNAs.Areas covered : circRNAs function , participate in protein coding
important for the disease	heterogeneous
the evidence for new exams	evidence from new trials
to provide a brief review of the literature with regard to the impact of lung cancer on cardiovascular disease	to integrate empirical and theoretical literature on fatigue among adults with type 1 diabetes mellitus
to explore the indirect influence of partners beliefs on diabetes distress at follow up	at further understanding
the risk of lung cancer	risk
on the need for new therapeutic strategies	on their follow - up
the same disease	patients
the most important role of the development of lung cancer	on the immunohistochemical level
to be improved	how these drugs may fit within the existing context of abiraterone
their [UNK]	cardiovascular benefits
the most important prognostic factor for lung cancer	an important part of the surgical treatment of advanced gastric cancer due to the high incidence of lymph node metastasis
with [UNK]	with symptoms from either a primary lesion or metastases
in the [UNK] of the [UNK] of [UNK]	from a complex inheritance - environment interaction along with other risk factors such as sedentary lifestyle
by advances in [UNK] enabling new insights into disease susceptibility	by advances in biomarkers enabling new insights into pathophysiology
the risk of gastric cancer	during cancer development
a major impact on endothelial function	HF compared with standard care
[UNK]	1.27 ( 95 % CI 1.09 to 1.48
higher levels of ii ep will moderate ndre impact higher levels of ee	higher levels of ( ii ) EP will moderate ( iii ) higher levels of EE
on the need for a new approach	on what is known about the role of comorbidities
the same	an even more radical modality that can deliver a greater dose of radiation to a localized lesion without affecting the surrounding normal tissue
the most common cancer cause of cancer death	the leading cause of cancer - related death
treat dogs with risk factors	definitive answers
[UNK]	all 141 patients with type 2 diabetes mellitus
[UNK]	Among these
to be [UNK]	to progressive failure of insulin secretion
a significant effect on the health of the health of breast cancer	an important role in the tertiary prevention of lung cancer
a [UNK]	the major risk factor for this disease
