in the disease	by an interaction of genetic factors
a disease	the levels of a global epidemic
the current [UNK] of cardiovascular disease	the most important recommendations for the management of patients with gastric cancer
as a major cause of cancer death in women in the united states	as a relevant exposure in prostate cancer prevention of mortality from this cancer
in the united states	2000
us	the poor connection that currently exists between the scientific community and the health sector in terms of resolving this health issue
[UNK] [UNK] [UNK] [UNK] [UNK]	a unique platform for transcriptional regulation
respectively 40 15 income in burkina faso	respectively 40 % , 15 209 % of per capita income in Malawi
the most important role of the disease	the primary care practitioner to best manage patients with this common disorder
[UNK]	almost five times higher - 84 in the official statistics ( for 100.000 population
[UNK]	for every 100,000 people
the presence of obesity	in bridging this gap
with the [UNK]	with an exercise program , cessation of the monitoring of blood pressure in high - risk patients
important in the us	clearly evident in the low suggesting that a large proportion of the country 's population may be at risk of developing serious lung diseases in the future
that [UNK] may be closely related to the disease	no significant differences in recurrence rate between laparoscopic surgery for gastric cancer and conventional gastrectomy
a [UNK] immune system to treat as [UNK]	juvenile diabetes previously
a major impact on the incidence of gastric cancer	an aggregation of credible variants in promoter - enhancer - like histone modification regions were specific to lung tissues Within the identified susceptibility regions
a [UNK]	the invigoration of regulatory T - cells ( Tregs ) , which can mediate draining lymph nodes
that the patients with chronic respiratory diseases experiencing depression [UNK] for [UNK]	that clonal haematopoiesis in the absence of overt haematologic alterations is associated with mortality
for gaseous pollutants	for time trends
important in the us	higher for girls than for boys
the current [UNK] [UNK] [UNK] in the treatment of gastric cancer	recent advances in the use of chemotherapy for advanced gastric cancer
to the [UNK] [UNK]	to their consulting diabetologists
to [UNK] [UNK] [UNK] [UNK]	to help choose from among approved therapies or evaluate drugs in development
the management of type 2 diabetes	that aspects of the aetiology of MBC do not fit the simplistic model
a role in the development of lung cancer	in the prevention of type 2 diabetes in children
a role	higher readiness scores for diabetes
a child	pregnant during the period of yearly viral epidemics
to treat [UNK]	medication
a [UNK]	in part genetically determined , involving HLA genes
the most important component in the us	the most important prognostic factor that should be considered in treatment selection
a significant effect	the increasing trends for the involvement of oxidative stress in the pathogenesis of T2DM In this regard
[UNK]	highest
on the molecular mechanisms	on recent high - quality studies
a significant effect	that a multifactorial process might be involved
a major impact on glycemic control of individual	high propensity to coexist due to shared etiological factors like clinico - pathological overlaps
the disease	by non-steroidal anti-inflammatory drug administration
in the development of lung cancer	in colorectal cancer development
for [UNK]	with tumor progression
respectively 431 in the private sectors	30.1 %
a political [UNK]	earlier in the disease course in the setting of metastatic castration - sensitive prostate cancer
[UNK] [UNK] [UNK]	new molecular subtypes of breast cancer
with the disease	with lung cancer risk
to provide the child with the skills necessary to manage diabetes over a lifetime	to assess vaccination coverage among Spanish children and adults with chronic respiratory diseases ( CRDs ) , and to describe the factors
the most frequently diagnosed cancer in women	a particularly difficult to manage phase of this spectrum
that the most important ongoing studies are shaping of the pursuit of positive response	that depression and anxiety were highly prevalent among the patients with chronic respiratory diseases
significantly	under the high aortic stiffness group
[UNK] [UNK]	the advantages of this molecular genetic movement , which include the abilities ( a )
mortality	the atherogenic activity of endothelial cells
[UNK]	accessing resources , medical knowledge deficits , ethics of transition - related medical care
to be [UNK]	in recent decades
at least 70 to 80 in patients with lymph node metastases in the resected specimen	80 %
structural ligands that alter the progression of chronic respiratory diseases	mammary proliferation
the risk of lung cancer	us to decipher just how the microbiota impacts type - 1 diabetes
[UNK]	ERBB2
[UNK]	differential expression across , developmental stages
to the management of lung cancer	to a better identification of patients
[UNK] patients with [UNK]	1 qualitative phenomenology
[UNK] [UNK]	the implementation of an optimal lung cancer prevention in the form of smoking cessation programmes
with the [UNK] of lung cancer	with a more rapid course of progression to metastatic disease
the effect of the development of complications	26.1 %
a [UNK]	higher in older age groups
[UNK]	a more ominous outlook
a major component of the concept	the only curative therapy for localized gastric cancer
to [UNK] [UNK] [UNK] [UNK] [UNK] [UNK]	to the current multidisciplinary approach to gastric adenocarcinoma
the risk of gastric cancer	our understanding of the role of genes in the etiology of colorectal cancer
that the risk may be decreased with a high intake of vegetables	that outcomes after surgery in patients with very early SCLC are comparable to those in patients with non-SCLC
with the disease	with complications , including amputation
a major cause of [UNK]	data extraction
a [UNK]	neutral or beneficial effects in various cardiovascular disorders
to the same level of the most frequently	current smoking ( odds ratio = 3.3
the same	more common in women
[UNK]	to cancer
to investigate the association between the respiratory muscle	to investigate whether maternal exposure during pregnancy to air pollution , measured as nitrogen oxides [ NOx ] , in a low - dose exposure area was associated with the child developing T1D
into five categories	into three categories
from the presence of [UNK] agents [UNK] in [UNK] [UNK] [UNK] in [UNK] [UNK]	from bone marrow
the treatment of type 2 diabetes	usefulness of T2 DM prevention , further to that
the [UNK]	with various pathophysiological factors
as a major new method of treatment options to men with [UNK]	ongoing
[UNK]	FGFR
a significant effect	immunological checkpoint inhibitors as the standard treatment for small cell lung cancer
an important role in the development of gastric cancer	the result of an extensive literature review
that the current multidisciplinary approach to gastric adenocarcinoma can be [UNK] cell or combination with chemotherapy of chemotherapy of [UNK]	that providing intensive blood glucose control significantly reduced the risk of microvascular complications , such as retinopathy , in patients with type 2 diabetes mellitus
in [UNK] [UNK]	at higher risk
a [UNK]	an avalanche of potential clinically applicable biomarkers
to provide the current knowledge of the possible treatment of lung cancer	to outline our current knowledge of the distinguishing features of the evolving evidence in this field
the most common cause of cancer death	a serious complication of diabetes mellitus
the [UNK] [UNK] [UNK] in the [UNK] of the [UNK] [UNK]	surgical aspects germane to the management of men with prostate cancer , including patient selection for surgery , nerve - sparing approaches
a [UNK] [UNK]	the crucial role of inflammation in the initial development
a [UNK] [UNK] [UNK] [UNK] [UNK] [UNK]	the foremost scientific conference in the world focusing on clinical prostate cancer research with the highest potential for accelerating the understanding of prostate cancer biology
in the last year	by a highly sensitive brain natriuretic peptide
the disease	likely to hold true for children
a new [UNK]	there is a clear trend to more aggressive treatment in newly diagnosed metastatic disease
[UNK]	as biomarkers of lung cancer
the current [UNK] of the clinical trials of [UNK] [UNK]	all issues related to the treatment of early breast cancer
male	a significant risk factor for the progression of cardiovascular disease , particularly when associated with other risk factors
important	different between these regions
the patients with high levels of [UNK] il 8	us to take a big step forward in the treatment of gastric cancer
for the treatment of type 2 diabetes	a rather interesting topic because in experimental models viruses appear capable of both accelerating as well as decelerating the immunological processes
responsible for the [UNK] [UNK]	curable with a combination of thoracic irradiation
to [UNK] [UNK] of [UNK] [UNK] [UNK] [UNK]	to HF outcomes in these contemporary clinical trial experiences
the most important [UNK]	type 1 diabetes mellitus T1DM
making a better prognosis for those with a [UNK]	making use of simulating amputation
the [UNK]	the development of T1DM
a [UNK]	currently not fully available for prostate MRSI
in the evaluation of the association the disease	to their clonal expansion within the limiting bone marrow niche
with type 1 diabetes	with physical activity
[UNK]	the mainstay for COPD whereas combined nasal CPAP are most frequently used for the overlap syndrome
to treat gastric cancer	after 1 year ( in 45 diabetics
by the parents	by breast cancer
to the major health problem	with the sleep / wake cycles
in [UNK]	following pancreas transplantation
[UNK]	insight into understanding the role of inflammatory mediators in the response to injury
[UNK]	1 diabetes
to provide the child with the problem of oxidation	to determine whether treatment options may be different in a molecular subset EOCRCs
the most common cause of cancer death	the leading cause of mortality in women
the risk of gastric cancer in men in the [UNK]	in the Netherlands
in the us [UNK] of the united states	from this pilot study as a effective therapy for reducing disability in patients with chronic neck pain
to explore the indirect influence of partners beliefs on diabetes distress at follow up	at assessing health - related quality of life ( HRQL ) in patients with long - term survival
in [UNK]	to the magnitude of the autoantibody response
the [UNK]	hypotheses on dietary risk factors for CVD
the most important advances in the literature	treatment for these men
[UNK]	ordinary differential equations to represent the dynamic interactions of multiple cell types
[UNK]	the interaction of PD - L1 with PD - 1
[UNK] [UNK] [UNK]	mainly by the Japanese Urological Association as a part of the 2003 - 2004 Ministry of Welfare ( MHLW ) Scientific Research Fund - supported Thorough Researches for the Evaluation of Medical Technologies
the same time	updated information on research
the right to the right or the [UNK]	insulin resistance
on the immune system	on the pathobiology of both type
a major risk factor for the progression of gastric cancer	still in its infancy despite the much earlier identification of targets like ER In comparison to tumors like EGFR - BRAF - mutated melanoma for example
a common disease	an insidiously starting disease
predictive	it possible to develop specific radioimmunoassays for the detection of autoantibodies on a large scale
1972	also lower than that
at a high risk of developing complications	to people
a number of patients with [UNK] [UNK]	into account gender differences
[UNK]	depending on tumor type of metastases
the [UNK]	hypotheses on nutritional risk factors for CVD
the risk of gastric cancer	a beneficial role regarding the development of diabetes
with the presence of [UNK] [UNK]	with a hereditary colorectal cancer syndrome
the same [UNK]	efforts to guarantee the transparency of the effective use of NSFC finding
in [UNK]	the predominant causes of death in 17 of 22 infants in the first two years
the risk of gastric cancer in the [UNK]	evidence for new susceptibility loci genes in the disease process including common susceptibility genes
a different [UNK]	more likely to occur in distal colon and rectum
with [UNK]	only with NMRD mortality
the [UNK]	partial mediation in working hours
in the [UNK]	after PRP
their patients	encourage them to take steps
a major component of the concept	a primary modality for the treatment of patients with colorectal cancer
the disease	the most prevalent chronic respiratory disease
in the past	although there is significant interest in further understanding disease pathogenesis in order already
a [UNK]	generally high
the association between polypharmacy and all cause of the development of cardiovascular disease	in the radiotherapeutic management of resectable gastric cancer
the risk of gastric cancer	an association between increased risk of hypoglycemia in older adults with T1D
to provide the child with the skills necessary to manage diabetes over a lifetime	to further characterize the extent of environmental exposures
controversial	more and more important for clinicians
the risk of lung cancer	research
to [UNK] [UNK]	about factors
patients	caregivers
to determine the prevalence of [UNK] [UNK]	to investigate the relationship among executive functioning , diabetes treatment adherence , and glycemic control
a [UNK] [UNK]	significantly lower than the controls
to identify autoantigens	regarding the association of particular taxonomic groups with disease
get some food	in the United States
the [UNK] [UNK]	family members following genetic counselling , the possibility of predictive carrier testing
her to [UNK]	the extent of the problem
the most important scientific research in gastric cancer	screening guidelines
the [UNK]	autoimmune diabetes , is a multifactorial disease affecting involving genetic susceptibilities
to the disease	the major starting point for almost all the gene therapy modalities
the disease	the risk
the most common cancer cause of cancer death	a curable disease regardless of its location , histologic type , genetic changes , or the ethnicity of the patient
the most common cause of cancer death	a crucial area of healthcare where information gaps are known to exist
the disease	the normal regulation of cell division
a major cause of the disease	by complex interactions between genetic , hormonal , behavioral , and environmental factors
lung cancer	mitochondrial activity
a [UNK]	fundamental when encouraging positive attitudes to personal responsibility for treatment for the condition
to treat dogs with [UNK]	to initiate beta - cell autoimmunity
the [UNK]	just the insulin system
to gain insight about the disease	to gain insight about the causes
in [UNK]	significantly higher in the diabetic group compared with controls ( respectively
in the past 20 years on account of its clinical application advantages such as [UNK] invasive visual clinical the of	in this article
in the study	2,984,634 women
cellular [UNK]	resistance
[UNK]	diabetes mellitus frequently
the most important prognostic factor which the biological clinical concept in the development of colorectal cancer	due to a ventricular septal defect in one
[UNK]	to influence the contribution of aging to the increasing global prevalence of diabetes
us	Spain
the most important ongoing research	that during PB a common rhythm is shared between the respiratory and cardiovascular regulatory system
in this review	to delineate their significance in lung cancer biology
the patients	an ongoing commitment to remain current in advances
to the [UNK] of [UNK] [UNK] [UNK]	to the higher incidence of EGFR mutation in nonsmokers
the treatment of type 2 diabetes	pain relief if used improperly Currently
[UNK]	a source of ATP
important	the key components to controlling cardiovascular diseases in refugees
the most important [UNK]	a unique RNA molecule with ring structure
to be [UNK]	into account at this point
significantly higher in the [UNK] of the [UNK]	into the clinic in recent decades
a disease	more evident in the prevalence of periodontitis
the most important [UNK]	our understanding of the function of the microbiota in this disease
in the past 20 years on account of its clinical application advantages such as [UNK] invasive visual or [UNK]	by the diagnosis of struggle
male	useful for differential diagnosis between FT1DM and acute - onset autoimmune type 1 diabetes mellitus ( T1ADM ) or not
for the united states	for women older than 40 years
the need for a new treatment of type 2 diabetes	countries address not only problems
in the study	Finally
modern [UNK]	an aggressive , treat - to - target strategy to lessen diabetes - related risk factors always
to be [UNK]	in the 1950 s with annual chest x-ray films
sex	1 diabetes mellitus
the most important health problem	still
a significant effect	the health services for NCDs , particularly in public facilities
to [UNK] [UNK]	about the features of venous tumor thrombosis in colorectal cancer
by the presence of obesity	with pharmacological reduction in resting heart rate
to the disease	to risks for poor outcomes in blacks with lung cancer
to provide the current knowledge of the molecular mechanisms with the molecular mechanisms	to provide an update on the recent advances in the surgical treatment of advanced gastric cancer
disease	death from breast cancer
in the [UNK] [UNK]	in non-small cell lung cancer In recent years
the role of [UNK] in lung cancer patients	the role it plays compared to the whole range of old treatment methods
the patients with chronic respiratory diseases	what their options are for diagnosis
the most important [UNK]	initially candidate for mastectomy
on the [UNK] participants	the relation between smoking and fatal prostate cancer risk
an important role in the development of lung cancer	that the improvement in breast cancer survival in men has fallen behind that of women
the most important role of the development of cancer	in everyday practice of cardiologists as well
the current [UNK] [UNK] [UNK]	the environmental primary tumor biologic factors that may explain these disparities
to the most important [UNK]	over the next 20 years
[UNK]	the countries with the lowest number
in china	in the literature
to the same [UNK]	by control
a role in the development of lung cancer	in the prevention of type 2 diabetes in adults
the risk of gastric cancer in men in the general population	direct evidence
as a risk factor for lung cancer	95 %
to the risk of gastric cancer	to etiopathogenesis
the same	critical steps in promoting nurse - led programmes
that you can get [UNK] in	the complex aetiology of the advance understanding closer to the ultimate goal of primary prevention
that the risk may be decreased with a high intake of fruit	that youth who begin intensive treatment as adolescents generally have good metabolic
to the major health	to the prostate gland , therapies for those
an important role in the development of lung cancer	local recurrence
[UNK] [UNK]	for this study finally
that the [UNK] is associated with [UNK] immune system is [UNK]	that stigma detrimentally affects communication
in the us	in systematic diseases such as diabetes
by the disease	by largely irreversible airflow limitation
into five categories	into five categories ; sleep assessment , sleep as co-morbidities of sleep
in [UNK]	low in both genders
a major public health problem	convinced of its critical value
a major disease	the second leading cause of cancer - related mortality
that [UNK] [UNK] [UNK] [UNK] [UNK] [UNK]	that physical activity not only protects against a number of cancer types , as well as for improving quality of life In recent years
the risk of developing cardiovascular disease	56 subjects
the treatment of type 2 diabetes	the diagnosis facilities also along with that screening facilities and what intervention can be made
colorectal cancer expertise of the chinese medical association to publish it publicly in 2010	"colorectal cancer expertise of the Chinese Medical Association """"""""""""""""""""""""""""""to write the """""""""""""""""""""""""""""""" Chinese Protocol of Diagnosis of Colorectal Cancer"""""""""""""""""""""""""""""" In 2010"
a [UNK]	a 49 % reduction in respiratory hospitalization rates In the entire cohort
that the current canadian diabetes association clinical high prevalence areas frequently	that living along busy streets increases the risk of developing chronic respiratory symptoms in children
the risk of gastric cancer	the risk of chronic diseases
the development of t2 dm	the development of cancer including obesity
by the public health institute	by the high - level molecular genetic diversity outline settings
to [UNK]	from a mixed - mode survey of Ohio cash grain farmers in 1993
the patients with [UNK] disease	patients who have been diagnosed
[UNK]	20 %
[UNK]	in Calgary , Alberta , Canada
patients with chronic respiratory diseases	T2 DM
both [UNK] and [UNK] [UNK]	vitamin D3 receptor trans activation
with the disease	with an increased incidence of myocardial infarction
a major cause of the [UNK] of [UNK]	one arm of the metabolic syndrome
the most important [UNK]	most useful to evaluate cystic breast masses
the most important health problem	avoidable
to the development of lung cancer	to growth
to be [UNK]	to be imported at high cost often
the current state of the relationship between [UNK] and the quality of life of life of life of life of	the molecular aberrations of prostate cancer cell growth
[UNK]	from chronic psychiatric disturbance
on the need of [UNK]	on smoking cessation better understanding disease development in nonsmokers
hypertension	advanced glycation end - products that result in atherogenesis
in the treatment of type 2 diabetes	with carcinogenesis
to examine the association between sex and breast cancer mortality mortality mortality after controlling for prognostic factors including [UNK]	to examine the association between sex and breast cancer mortality after controlling for prognostic factors , including tumor grade
in the past 20 years on account of its clinical application advantages such as [UNK] invasive visual or [UNK]	in the knowledge of the pathogenesis of gastric cancer Over the past 15 years
ndre impact higher levels of ee	in EP
from [UNK]	from the autoimmune destruction of insulin producing islet beta cells
a [UNK]	a chronic disease
to the [UNK] of [UNK] [UNK] [UNK]	to perceived health status , including overall QoL
the risk of gastric cancer	the risk factors present in childhood that are associated with future cardiovascular events in adulthood
a number of immune abnormalities in the disease	a faster decrease in three RAND - 36 subscales over time than the estimated decrease in the general population
by the disease	by magnesium deficiency
in the most important clinical practice guidelines	progression during the follow - up period
[UNK]	platelet therapy
the [UNK]	a combination of factors , such as genetic exposure to environmental triggers
that [UNK] may be closely	T cells as a target for preventive strategies
the program	the teeth
the patients with type 2 diabetes	for conversion of an initially unresectable gastric cancer to resectable cancer in clinical practice occasionally
a brief summary on various applications by ngs	a brief introduction on various applications by NGS in lung cancer advances , including further discoveries in previously known target genes
to [UNK] [UNK]	to be carefully reconsidered
the most common cancer [UNK]	the most important chronic disease in women
for the future of patients with [UNK]	apparent until later
a new treatment options to men with a disease	the treatment costs for patients
the most important considerations in the future of the therapy of the patients with cardiovascular disease	important for effective treatment
important for the disease	In this final section
the most common cause of cancer death	one of the most common cancers
to the current [UNK]	from the Global Burden of Disease Study
that [UNK] is associated with [UNK] [UNK]	that foundryworkers are more prone to bronchitis than other industrial workers
the effect of [UNK] in the development of t2 dm	risk
in the pathogenesis of type 2 diabetes	in the pathogenesis of various lung diseases including chronic obstructive pulmonary disease
to [UNK]	a patient
a major cause of lung cancer	a lifelong requirement for insulin
to examine the association between polypharmacy and the developing states	to identify relevant literature
with the disease	with chronic hyperglycemia
the [UNK]	in ACP
the risk of gastric cancer	controversies
lung cancer	additional information to predict rapid progression to diabetes
the [UNK]	the data
in [UNK] [UNK]	in the and rectum
a significant risk of the development of lung cancer	more early stage EOCRCs
the most important ongoing research	immense
the most important ongoing research	progression to castration - resistant prostate cancer
[UNK]	outpatient primary care clinics
in [UNK] in [UNK]	after pump introduction
with [UNK]	with gastric cancer
with [UNK]	with lung cancer susceptibility
to provide the child with the skills necessary to manage diabetes over a lifetime	to provide the child with the skills necessary to manage diabetes over a lifetime
the most important [UNK]	from all types of alcoholic beverages
with [UNK]	with t2DM
a [UNK]	coronary artery disease , 19 % peripheral vascular disease , 11 % cerebrovascular disease , 33 % At start of renal replacement therapy
the disease	by a toxic or infectious insult
in the [UNK]	in chronic inflammation
to provide the current knowledge of the molecular mechanisms with the molecular mechanisms	to define the actual landmarks of this procedure
