to promote mutual understanding	to provide a timely snapshot of the political aspects of this environment as it applies to practice internationally
an important role in the development of lung cancer	a challenge for pediatric endocrinologists
important	a role
the same disease	the quality of life of patients with chronic diseases
the same mutation in the prion gene in quanto1 families	towards a new paradigm
[UNK]	a lot of similarities with female breast cancer
in [UNK]	with methylation.specific PCR in 36
with higher risk of gastric cancer	with Perceived Stress Scale
with a [UNK]	to clinical variables
in the most important health	in 174 ( 62.6 % ) and high in 46 ( 16.6 % ) patients
the risk of lung cancer	a lower prostate - specific antigen
to treat the disease	entirely novel therapeutic avenues
in [UNK]	26
make person unhappy	varied study designs and outcomes to test behavioral economic interventions in clinical , workplace , or health plan settings
[UNK]	fatigue and diabetes - related symptoms
by the public health care [UNK]	to elucidate the possible mechanisms
lung cancer	adjunctive exercise and lifestyle interventions
[UNK]	higher than lysozyme
the [UNK] of [UNK] [UNK] in the [UNK]	the usefulness of resistance training in the treatment of type 2 diabetes mellitus
a role in the development of gastric cancer	critical roles in the tumorigenesis of GC
a [UNK]	common amongst the ageing population
millions of years old with [UNK]	in EE
the most important ongoing research	resource allocation
to provide a significant association between t1 dm and the clinical characteristics	to determine the epidemiological characteristics of hereditary colorectal cancer in India
[UNK] of [UNK] in the [UNK] of [UNK] [UNK] [UNK] [UNK]	utilization of glucose by tissues in hepatic handling of glucose with the onus on Gluconeogenesis
to provide the child with the skills necessary to manage diabetes over a lifetime	to compare CT - derived airway wall measurements between male smokers with and those without chronic respiratory symptoms
on the [UNK] of the treatment of gastric cancer	on saving the lives of women with this condition
that the [UNK] [UNK] [UNK] [UNK] [UNK]	on all admissions to hospital
with [UNK]	with diabetes mellitus
a major health risk factor for the development of gastric cancer	chronic hyperglycemia
the most common cause of cancer death	a challenge for clinicians
the risk of gastric cancer	presence of comorbid conditions
the results of [UNK] [UNK] [UNK] [UNK] [UNK] [UNK]	that CFs exposure may lead to lung cancer by gene damage
to provide the current knowledge of the possible treatment of lung cancer	to outline our current knowledge of the distinguishing features of early - onset CRC
a significant effect	$ 82.99
important in the development of lung cancer	after that while emphasizing how a patient 's treatment requires changes over time
[UNK]	necessary
the [UNK]	blood pressure
that the [UNK] is still	a stronger genetic susceptibility , associated with a more aggressive autoimmune process
the risk of gastric cancer	the Preferred Reporting Items for Meta - Analyses ( PRISMA ) guidelines
a significant effect	90 - day mortality in patients with hypercapnia
[UNK]	previously
to provide the current knowledge of the possible treatment of lung cancer	to consider further implications for public health
for [UNK] [UNK] [UNK]	in vasoconstriction
the most common cause of cancer	a growing health challenge
the most important health problem	a potential opinion of the healthcare personnel
for [UNK]	significant for wheeze
for the past 20 years on account of its clinical application advantages such as [UNK] therapy biomarkers	for screening distinguishing latent from predicting outcome
[UNK]	from lesions in the crypt of the colon
to identify acute acute acute respiratory diseases	to identify acute ( acute upper respiratory diseases
a [UNK] [UNK]	additional diagnostic information
the disease	cardiovascular health
the risk of lung cancer	an opportunity to reduce deaths
to provide the current knowledge of the clinical issues	to overview the reality of breast cancer at present , trying to clarify the numerous elements of classification , otherwise confusing
important for survival	key to the discovery of the genes for diabetes
the effect of [UNK] in the development of gastric cancer	an unprecedented change in our understanding of the heterogeneity of breast cancer metastasis Recently
the same disease	to be considered while designing future management strategies
lung cancer	inflammatory cytokines while normalizing membrane structure
in the past 20 years on account of its clinical application advantages such as [UNK] invasive visual line making it	a 71 - year - old woman with aquaporin -4-antibody positive neuromyelitis optica
in the [UNK]	under the hub of personalized medicine
death	abnormal carbohydrate metabolism impaired insulin secretion
similar between the two groups	concomitant with the eradication of infection
a significant effect	high levels of IL - 10
the same mutation in the prion gene in quanto1 families	whereas the EG showed a greater improvement in transitional dyspnoea index than the CG
the risk of lung cancer	worse control of their diabetes
to be [UNK]	ill
the women	either a 5 - HT7 receptor antagonist ( SB269970 , 4 mg / kg , intraperitoneal ) or a vehicle ( dimethyl sulfoxide On a daily basis
by [UNK]	by non-genetic factors
[UNK] [UNK]	in women
to the current multidisciplinary approach to gastric adenocarcinoma	It is widely accepted that type
a [UNK] effect on the body	little influence on PMc effect estimates
a significant increase of the risk of gastric cancer	from 0 - 1 % in individuals with only one positive antibodies to 62 - 100 % in subjects
the information on the use of the [UNK] of [UNK]	to report on important developments in the treatment of breast malignancies
a major cause of mortality	high mortality in Africa
a role in the development of gastric cancer	an important role in the regulation of various genes
the [UNK]	an antitumor immune response
[UNK]	interested researchers
the current state of the clinical trials of [UNK] drug for patients	the current recommendations for diabetes self - management skills including medical nutrition therapy
in the [UNK] of the treatment of gastric cancer	in the contemporary treatment of GC
in the [UNK]	from the fact that most cases are diagnosed in the advanced stage of the disease
a new treatment strategy	1 diabetes mellitus
the [UNK] [UNK] immune [UNK] immune [UNK] immune [UNK] immune [UNK] molecules	millions of people worldwide
[UNK]	relatively long
available commercially	clearly of more benefit to female non-smokers
a potential for preserving therapy	In this final section
in the [UNK]	infections factors
to treat the disease	across all Latin American countries to improve health conditions particularly for women
a disease	an established risk factor for nephropathic events
with the progression of [UNK]	with the development of cardiac hypertrophy
[UNK]	current in advances
the risk of lung cancer	the survival of gastric cancer patients
a significant effect	multiple potential non-genetic biomarkers for the risk of T2D
the most important ongoing studies	the gaps in our knowledge of the epidemiology of this disease
the risk of gastric cancer	each other
the need for a healthy family	an increase in the incidence of diabetes all over the world , which suggests that a multifactorial process might be involved
cancer	cancer - specific antigens
diabetes	metabolic syndrome
to produce a significant effect on the health of the development of the new [UNK] mechanisms of the molecular mechanisms	to explore views of the rarely mentioned mechanism , and the cardiovascular effects of low levels of lead exposure
to assess the current treatments available for the molecular aspects	to investigate the independent association of asthma with lung cancer
to determine the effect of [UNK] on the [UNK] of [UNK]	to estimate this effect
for the future of patients with [UNK]	as the cornerstone management measure
to the disease	disease
the current [UNK] of cardiovascular disease	therapy of neoadjuvant treatment in LAGC
keeping a body alive	to preclude airway disease in individuals with unspecific respiratory symptoms often
the risk of gastric cancer in men after endoscopic resection	the relative risks of type 2 diabetes mellitus risk for individuals with hypertensive disorders during preeclampsia
a major risk factor	a major role in the pathogenesis of colon cancer
in the [UNK]	in its infancy
by advances in [UNK] enabling new insights into disease susceptibility	by advances in human genetics enabling new insights into development of complications
this disease	this consensus
lung cancer	insulin resistance while normalizing membrane lipid composition
a common disease	integral for the diagnosis
[UNK]	we are still challenged to develop public health strategies for the foreseeable future
a [UNK] [UNK]	significantly low rates for CRC screening
the same time	by a nurse
a major cause of cancer related death in women	unique in each patient according to clinical response
a disease	specific to the U.S.
the same disease	the association with increased morbidity
to the disease	to several complications , including peripheral arterial disease
in the past	in the clinical care of T1 D
in [UNK]	among US women in 2011
a major public health problem	at maximum risk for disease
[UNK]	a major causative factor for the development of oxidative stress
patients	patient engagement
to investigate the association between the respiratory muscle	to investigate the cognitive functioning of patients with type 1 diabetes ( including a subgroup ) and nondiabetic controls
the same disease	QT interval
[UNK]	the survival rates for patients with breast cancer more optimistic
[UNK] [UNK] [UNK] [UNK]	original reports of case - control studies of the association of asthma with lung cancer
on [UNK] of [UNK]	at baseline adjusting for education
to treat dogs with risk factors	to be studied prospectively compared to postoperative chemoradiation
to promote mutual understanding	to facilitate cooperation , so as to upgrade the effective control of lung cancer
the most important [UNK]	more likely to report fair / poor health
the risk of gastric cancer	a novel strategy for better treatment of patients
the most important health problem	possible
more important in the developing countries	the top priority for our surgeon
important	one of the main roles of surgical oncologists in the near future
a number of immune abnormalities in the disease	36 weeks pca 35 %
with the disease	with various other comorbidities , including tobacco use
the [UNK] [UNK]	Clinical Diagnostic Imaging of Prostate Cancer
on the need for new therapeutic strategies	on the recommended preoperative evaluation of patients
a [UNK]	the seventh leading cause of cancer mortality
to be [UNK]	substantially higher in men with CLRD when compared with normal subjects
[UNK]	All studies
the current [UNK] of cardiovascular disease	treatment - related factors
[UNK]	suitable pedigrees
with the [UNK] of [UNK]	with higher rates of cardiovascular disease suggesting a previously unrecognized link between somatic mutations in hematopoietic cells and chronic disease
the most common cause of cancer death	also a leading cause of mortality
measure the progress	in clinical outcome measures
the same time	as therapeutic targets helping to prevent development of castration resistance
[UNK] [UNK]	studying mechanisms by outlining effects of positive emotions on managing consequences of depression in these patients
to be [UNK]	to adherence
by the disease	by difficult to treat infections
important roles in the progression	valuable for type 1 diabetes
a higher rate of the most important role of the development of the disease	the gene - environment interactions
for the most common cancer of the women	for guiding the management of patients
[UNK]	the combination of immunotherapy
research	research
with the disease	with type 2 diabetes mellitus
for [UNK] patients with t2 dm	for more than 2 years after the diagnosis although five of the 11 patients had liver metastasis
the same disease	promise in reducing the burden of adult cardiovascular disease
in the treatment of type 2 diabetes	in a reduced incidence of colorectal cancer in true population studies despite removal of two to three times as many possible precursors compared to controls So far
to elucidate this entity by reviewing the current medical literature till april 2011	to elucidate this entity , by presenting several aspects of the disease including major differences between the groups of breast cancer patients , by reviewing the current medical literature till April 2011
[UNK] [UNK]	the foundation for optimal design of future studies
[UNK] [UNK]	multivariable logistic regression analysis
a major component of the management of gastric cancer	by patient trust in one 's physician in addressing colorectal cancer disparities , including the need for studies
to investigate the association between the respiratory muscle	to evaluate the neurofunctional effect of gender in Type - 1 Diabetes Mellitus ( T1DM ) patients during a Visual Spatial Working Memory ( VSWM ) task
a [UNK] [UNK]	an overview of potential future directions for research
[UNK] of the [UNK]	as the ratio of DALYs from communicable diseases to those from non-communicable diseases
winning or losing	onset of disease
the same [UNK]	treatment adherence
important for the future of the disease	less than optimal in many patients with type 2 diabetes mellitus
a [UNK]	feasible in such cases
the [UNK]	successful clinical management of this disorder
the same disease	on earlier intervention if adverse outcomes are to be reduced
significantly higher of those	momentum for some years on account of its high incidence
[UNK]	19.9 % in children
to the patients with chronic respiratory diseases	to be aware of the increased risk for cardiovascular disease in bipolar patients
the disease	with females
in the [UNK]	To date
[UNK] immune responses	inconsistent care coordination contributing to the physical isolation of these children
a long time	a role at the level of perpetuation of the autoimmunity process
the results of the [UNK] [UNK] [UNK] [UNK] [UNK]	accurate information regarding management
the [UNK]	as a worldwide public health problem
a number of immune abnormalities	very fast growth rates
with [UNK]	In vivo experiments present meaningful profiles for other situations
cellular [UNK] cell of [UNK]	cellular alterations in genes
to the risk of lung cancer	clearly of interest to investigate this treatment concept
long term survival	long - term survival while accounting for life expectancy
on the need	on shared molecular pathogenesis
us [UNK] for [UNK] representing respectively 40 15 income in burkina faso	US$ 1501.79 for budesonide , representing respectively 40 % , 15 209 % of per capita income in Burkina Faso
[UNK]	95 %
a number of industry legends including apple founders steve jobs	fair knowledge
to the risk of lung cancer	to adherence
important	relative risk of death according to comorbidities
in the [UNK]	in the evaluation of high - risk patient populations improves outcomes
a major political system	rapid socioeconomic changes
the risk of gastric cancer	better patient prognosis
on the immune system	on endurance exercise
important	part of targeted diabetes care
patients with chronic respiratory diseases	patients with this serious disorder
[UNK]	that this technique may downstage tumors
the most important [UNK] of the disease	modifiable
in the most important treatment of gastric cancer	by sputum cytology usually
quanto1	independent predictors of cardiac deaths
[UNK]	potential value
to the major [UNK] the [UNK] of gastric cancer	to a focus group of African Canadians in Calgary to garner their perspective on the findings
the most common cancer cause of cancer death	a complex disease composed of diverse molecular types with clinical relevance
substantially between eastern and western countries owing to numerous factors including government incentives to carry out population wide screening programmes	substantially between Eastern and Western countries owing to numerous factors , including government incentives to carry out population - wide screening programmes to detect early disease , differences in biological , patient accessibility to effective treatment
the treatment of type 2 diabetes	now standard care in 2014
to treat the disease	all over the world frequently
the need for a new job	caregivers
the same [UNK]	the predictors of blood glucose control
with quality of life exercise in prognosis in various conditions including chronic obstructive pulmonary disease	with quality of life , exercise ( in ) tolerance in various conditions , including chronic interstitial lung disease
a number of patients with [UNK]	by medical research in understanding the pathophysiology of cardiovascular disease
the [UNK]	a number of chronic respiratory diseases
to promote mutual passion	disease
by the disease	by defects in insulin secretion
[UNK] [UNK]	a family history of the disease
[UNK]	for palliation
the [UNK]	people 's lives
the same disease	beta - cell failure
by the most important [UNK] [UNK]	by specific genetic alterations providing direct evidence for genotypic - phenotypic correlations between morphological patterns and molecular changes in breast cancer
a significant effect	a poorer prognosis In relation to older women
to be [UNK]	controversial
for the past 20 years on account of its clinical application advantages such as [UNK] therapy biomarkers	for diagnosis distinguishing latent from differentiating localized from metastatic disease
a new method of early treatment strategies	the leading role of chronic enteric toxic infectious process in the development of complications of type 1 diabetes
on the need	on this disease entity
to examine the evidence	into account in this review
casual fridays with free pants	a lifestyle that may reduce comorbidities
to provide the current understanding of the possible treatment of type 1 diabetes	to discuss MPLC in general
with [UNK]	with greater improvements in psychological symptoms
the risk of gastric cancer	the inclusion criteria Twelve cohort
with the disease	with type 1 DM
the [UNK] [UNK] [UNK] in the treatment of type 2 diabetes	the literature supporting genetic determinants in the pathogenesis of T2 D
the treatment of [UNK]	whether early dietary changes can reduce the longer term complication of frailty in people at risk for T2DM
to treat [UNK]	respectively
the [UNK] of [UNK] in the [UNK] of the [UNK] immune system	that the optimum cut - off value for GA was 33.5 % with sensitivity and specificity of 97.4 % and 96.8 % , respectively
in [UNK]	by an increase in diabetes in hospitalised patients
a new method of research	provide a basis for future research
that the patients with chronic respiratory diseases experiencing depression [UNK] for [UNK]	that sex differences should be considered when studying T1DM - disease development
in this review	several major themes
[UNK]	PARP inhibitors
with the disease	with respiratory disease in the Asia - Pacific
in the [UNK]	at home
the ability to identify individuals at risk for [UNK]	patient conditions
[UNK]	more industrialised
in the past tense of gastric cancer	against high LDL - C levels
the treatment of type 2 diabetes	antioxidant activity of the renin - angiotensin - aldosterone antagonists
good	identify patients for overnight study
to treat dogs with [UNK]	in the kidney
the association between polypharmacy and all cause of the [UNK]	what is known about how long - term aerobic exercise can reduce the atherogenic activity of endothelial cells
a significant effect	considerable geographic variation
the most important [UNK] [UNK] [UNK] [UNK] [UNK]	the pathogenesis of lung cancer in China
the treatment of type 2 diabetes	individual renal transplant recipients given their high cardiovascular mortality
[UNK]	other insulin secretagogues
to provide the child with the problem of oxidation	to model mortality rates by calendar time
their patients with a high quality of life	to enhance their quality of life from diagnosis , during the disease trajectory
in [UNK]	in both developed and developing nations
the [UNK]	the healthy cells
the patients with a high risk of lung cancer	particular attention to patients with co-existing neurodevelopmental disorders such as ADHD
the association between polypharmacy and all cause of be [UNK]	the proliferation
to investigate the association between the respiratory muscle	to evaluate the effect of coexisting respiratory diseases on OUES in patients with chronic heart failure ( CHF ) ( New York Heart Association class II - III ) during incremental exercise testing
the patients with type 2 diabetes	to the development of cardiovascular disease
with [UNK]	during 6MWT for subjects with interstitial lung disease
responsible for the immune system	in the last century worldwide
a number of immune abnormalities in lung cancer	an independent predicted biomarker with limitations
a major cause of cancer related death	an important cause of cancer - related mortality
the current knowledge on the role of mirnas in molecular mechanisms	the current state of PRS for prostate cancer including testing considerations
[UNK]	dyspnea
to treat dogs with [UNK]	This review will cover the epidemiologic characteristics of the influence of race
the same disease	completely known still
to the disease	to a decrease in mortality
the treatment of type 2 diabetes	overtreatment of localized disease
to the disease	to COPD
the patients	the lives of Chinese people
the other [UNK]	information about preconception care
in the [UNK]	40 years
in the us	concerns about financial burden
to [UNK] [UNK]	to about 15 % - 20 %
a major impact on cardiovascular disease	major roles in the initiation
the same	a group of recently defined peptide members of the corticotrophin - releasing factor family
the same time	in fact sporadic rather than familial
the most important [UNK]	the increased adoption of screening
to examine the evidence	to systematically review ACP practice in chronic respiratory disease , attitudes of facilitators related to engagement in ACP
as the [UNK] [UNK] [UNK]	under way Now
in the clinical [UNK] of lung cancer	since the previous decade
to examine the association between sex and breast cancer mortality	across all Latin American countries to improve health conditions particularly for women
the [UNK] [UNK] [UNK] [UNK] in the [UNK] of [UNK] [UNK]	recent evidence on ethnic differences in its correlates with acquired differences in plasma lipid
the most important [UNK]	immunoresponsive
important	more successful in countries with stronger tobacco survival benefits in smokers including lung cancer patients
a [UNK]	profound problems with respiratory symptoms
the [UNK]	the impact of NDRE on CA among youth 11 - 13 yr
in [UNK]	positive
in the us	as a model in numerous methodological studies in chronic airflow limitation
lung cancer	complications
the [UNK]	new technologies to characterize immune responses toward these proteins
[UNK]	fundamental to the diagnosis of alveolar hypoventilation and of failure of the protective cough mechanism
in the past	in gender inequalities
the [UNK]	the immune system 's recognition
for the future [UNK] therapy	patient care
that the risk may be decreased with a high intake of vegetables	that adolescents ( young women ) have an increased risk for sub-clinical eating disorders
important	well - known
unwilling to give up the [UNK]	by its confounders , such as C - reactive protein
[UNK]	to treat T1DM
a [UNK]	to this high - risk population
the most important [UNK]	1.59 ( 95 % credibility interval during pregnancy
a family history of the disease	questionnaires , including Behavioral Rating Inventory of Executive Function
le [UNK] a deep water line of the water in the ocean	le Traitement A disorders
a major cause of cancer related death	one of the leading cause of death by cancer worldwide in both women
the treatment of type 2 diabetes	the correct management of their relatives
to [UNK]	in the assessment of this disease , including therapeutic assessment
to the disease	from 199 primary care centers
in the [UNK] of [UNK]	in late - stage diagnosis often
with [UNK]	with exposure to smoke from biomass / coal burning
the same	severe
[UNK]	critical features of frailty
to be [UNK]	to be learned about why this epidemic is occurring presently with regard to other environmental factors still
[UNK]	approximately 17 million adults in the United States
to assess the effects of [UNK]	on Mexican patients
the management of type 2 diabetes	us with powerful prognostic tools in the near future
important	an area of emerging focus that might help optimize therapeutic dietary response in the future through personalization
to examine the association between polypharmacy and all cause of all cause of [UNK]	on 86 diabetic patients
as a major cause of cancer	mortality
on the need of [UNK]	on means by which primary care nurse practitioners ( NPs ) might evaluate the utility of pharmacologic agents
a major public health issue	an effective alternative to surgery in breast cancer
the current [UNK] [UNK]	commonly encountered findings in the diagnosis of patients with colorectal cancer using computed tomography ( CT ) colonography , magnetic resonance imaging
the same [UNK]	the rationale
a major health problem	no differences
the problem	any improvement in overall survival ( OS ) especially with immune checkpoint inhibitors
[UNK]	valuable in the evaluation of hepatic disease
critical issues	in the last decades
for patients with t2 dm	helpful
this approach	absorption of dietary glucose from intestine
a major cause of death in adults	the leading cause of blindness
the most [UNK] [UNK] [UNK]	forward because it provides a possible explanation of tumor hierarchy
the same disease	men have the support
